title,title_furigana,title_en
オイ!! オバさん,Oi!! Obasan,
おいしい神しゃま,おいしいかみしゃま,Oishii Kamishama
おいしい関係,おいしいかんけい,Oishii Kankei
おいしい銀座,おいしいぎんざ,Delicious Ginza
美味しんぼ,おいしんぼ,Oishinbo
おいでませり,Oidemaseri,
おいでよ どうぶつの森 〜しあわせ通信〜,おいでよどうぶつのもり しあわせつうしん,Oideyo doubutsu no mori Shiawase tsuushin
おいでよ動物病院!,おいでよどうぶつびょういん,Welcome to the animal hospital.
お〜い!!マンガだよ〜ん ゆでたまご短編集1,おーいまんがだよーんゆでたまごたんぺんしゅう1,Oi manga dayon
オーイ!!やまびこ,Hey! Echo,
お〜い!竜馬,おーいりょうま,Ooi Ryouma
オイレンシュピーゲル(曽我部修司版),Eulenspiegel ver.Sogabe,
オイレンシュピーゲル(二階堂ヒカル版),Eulenspiegel ver.Nikaidou,
王狩,おうがり,Ogari
王家の紋章,おうけのもんしょう,Embrem of King's family
王国ゲェム,おうこくげぇむ,Oukoku Game
逢刻町そらそれ,おうこくちょうそらそれ,Oukokuchou sorasore
黄金戦士ゴールドライタン,おうごんせんしごーるどらいたん,Golden Warrior Gold Lightan
黄金太閤記,おうごんたいこうき,OGON TAIKOKI
黄金都市 (短編集),おうごんとし,Ougon Toshi
黄金の酔拳士,おうごんのどらっけん,Ougon no drakken
黄金のラフ 〜草太のスタンス〜,おうごんのらふ そうたのすたんす,Golden Rough Stance of Souta
黄金バット(週刊少年キング版),おうごんばっと しゅうかんしょうねんきんぐばん,Ougon Bat (Shounen King)
王様ゲーム【水野十子版】,おうさまげーむ,King game
王様ゲーム 起源,おうさまげーむ きげん,Ousama Game Kigen
王様ゲーム 終極,おうさまげーむ しゅうきょく,Ousama Game Shuukyoku
王様ゲーム(連打一人版),おうさまげーむ れんだひとりばん,Ousama Game
王様のオーパーツ,おうさまのおーぱーつ,KING'S OOPARTS
王様の仕立て屋〜サルト・フィニート〜,おうさまのしたてや さるとふぃにーと,Sarto Finite
王様の耳はオコノミミ,おうさまのみみはおこのみみ,Osama no mimi ha Okonomimi
王様はロバ〜はったり帝国の逆襲〜,おうさまはろばはったりていこくのぎゃくしゅう,Ousama ha roba
王子様のつくりかた,おうじさまのつくりかた,Make of prince
奥州藤原四代,おうしゅうふじわらよんだい,Oushu Fujiwara four generations
凹村戦争,おうそんせんそう,Ouson Sensou
おうちがいちばん,Ouchi ga ichiban,
oh!体験時代,おうっ たいけんじだい,Oh Taiken Zidai
応天の門,おうてんのもん,Oten no mon
王道の狗,おうどうのいぬ,Odo no inu
Oh!透明人間,おう とうめいにんげん,Oh toumei ningen
Oh!透明人間21,おう とうめいにんげん にじゅういち,Oh toumei ningen 21
おうどうもん,Oudoumon,
王ドロボウJING,おうどろぼうじん,King of Bandit JING (Oh Dorobou JING)
逢魔ヶ刻動物園,おうまがときどうぶつえん,Oumaga Toki Doubutsuen
桜蘭高校ホスト部,おうらんこうこうほすとくらぶ,Ouran High School Host Club
王室教師ハイネ,おうりつきょうしはいね,KONIGLICHE FAMILIE LEHRER
王狼,おうろう,OUROU
王狼伝,おうろうでん,OUROUDEN
O/A,おーえー,O A
オエカキスト!,Oekakist!,
お江戸はねむれない!,おえどはねむれない,Not sieep Edo
OL進化論,おーえるしんかろん,OL sinnkaronn
OLはとぽっぽ,おーえるはとぽっぽ,OL hatopoppo
OLパラダイス,おーえるぱらだいす,OL Paradise
大あばれゴジラ,おおあばれごじら,Ooabare Godzilla
大いなる完,おおいなるかん,Ooinaru Kan(the great Kan)
大江戸きっちん,おおえどきっちん,Oedo kitchen
大江戸国芳 よしづくし,おおえどくによし よしづくし,Ooedo Kuniyoshi Yoshi Dukushi
大江戸ジゴロ,おおえどじごろ,OHEDO JIGORO
大江戸バーリトゥード,おおえどばーりとぅーど,Ooedo Valetudo
大江戸ロケット,おおえどろけっと,Oh!-EDO Rocket
大江山流護身術道場,おおえやまりゅうごしんじゅつどうじょう,Ooeyama ryuu goshinjutsu doujou
大奥,おおおく,Oh-oku
大奥でございます。,おおおくでございます,OH OKU DE GOZAIMASU
おおかみかくし 滅紫の章,おおかみかくしけしむらさきのしょう,Okami kakushi keshimurasaki no shou
おおかみこどもの雨と雪,おおかみこどものあめとゆき,Ookamikodomo no ame to yuki
大上さん、だだ漏れです,おおがみさんだだもれです,Oogami San Dadamore Desu
大上さんとケルベロスゥ!,おおがみさんとけるべろすぅ,Oogami-san to kerberos!
オオカミ少女と黒王子,おおかみしょうじょとくろおうじ,Ookami shoujo to kuro ouji
狼少年ケン,おおかみしょうねんけん,Ookami shounen Ken
狼と香辛料,おおかみとこうしんりょう,Spice and Wolf (Okami to Koshinryo)
オオカミなんかコワくないっ!?,Who's afraid of Wolves!?,
狼なんて怖くない!! -冨樫義博短編集-,おおかみなんてこわくない とがしよしひろたんぺんしゅう,Okami nante kowakunai
狼の星座,おおかみのせいざ,Ookami no seiza
オオカミの手かします!,おおかみのてかします,Ookami no te kashimasu
おおきく振りかぶって,おおきくふりかぶって,Ookiku furikabutte (Big Windup!)
おおきに関ジャニ∞!!,おおきにかんじゃにえいと,Ookini Kanjani Eight
大斬─オオギリ─,おおぎり,Oogiri
大食い甲子園,おおぐいこうしえん,Oogui koushien
大蜘蛛ちゃんフラッシュバック,おおくもちゃんふらっしゅばっく,Ookumo Chan Flash Back
大阪ハムレット,おおさかはむれっと,Osaka Hamlet
大阪豆ゴハン,おおさかまめごはん,Ohsaka mame-gohan
大阪RED,おおさかれっど,OSAKA RED
大相撲刑事,おおずもうでか,Ohzumou-Deka
大谷さんちの天使様,おおたにさんちのてんしさま,Ootanisanchi no tenshisama
鳳,おおとり,OHTORI
鳳ボンバー,おおとりぼんばー,OHTORI BOMBER
大トロ倶楽部,おおとろくらぶ,Ootoro kurabu
大泥棒ポルタ,おおどろぼうぽるた,Oodorobou Poruta
大ボケ超人ウッカリマン,おおぼけちょうじんうっかりまん,OHBOKE SUPER MAN UKKARI MAN
大ぼら一代,おおぼらいちだい,Obora Ichidai
大室家,おおむろけ,Oomuro-ke
大家さんと僕,おおやさんとぼく,Ooyasan to Boku
大家さんは思春期!,おおやさんはししゅんき,Ooyasan wa shishunki!
おお!われら三人,おおわれらさんにん,Oo! warera ga sannin
おかあさまといっしょ,Okasama to Issho,
おかあさんがいっしょ,Okaasan ga issyo,
お母さんは「赤毛のアン」が大好き,おかあさんはあかげのあんがだいすき,Okasann ha akage no an ga daisuki
おかいあげ!,Okaiage!,
おかか,Okaka,
岡崎に捧ぐ,おかざきにささぐ,Okazaki ni sasagu
おかしな★ふたり,おかしなふたり,Okashina Futari
おーがちゃん,Ogre-chan (ooga chan),
オガッツ!,Ogatu,
おがにくうーちゃん,Girl in forest (Oganiku uuchan),
おかみさん-新米内儀相撲部屋奮闘記-,おかみさんしんまいないぎすもうべやふんとうき,OKAMISAN
おがみ松吾郎,おがみまつごろう,OGAMI MATUGOROU
拝み屋横町顛末記,おがみやよこちょうてんまつき,Ogamiya yokochou tennmatuki
岡本倫短編集 Flip Flap,おかもとりん たんぺんしゅう ふりっぷふらっぷ,Okamoto Lyn shortstories Flip Flap
オカルト・バージン,Occult Virgin,
小川とゆかいな斎藤たち,おがわとゆかいなさいとうたち,Ogawa to Yukaina Saitou Tachi
おかわりナポリタン,Okawari Neapolitan,
おかん,Okan,
おかん (凪原ナツ),Okan - Nagihara Natsu,
おかん(もりやまつる),Okan Moriyama Tsuru ver,
オキザリスの旗 長宗我部元親伝,おきざりすのはた ちょうそかべ もとちかでん,The Attitude of Oxalis
掟上今日子の備忘録,おきてがみきょうこのびぼうろく,Okitegami Kyouko no bibouroku
沖ノ毒島姉妹,おきのどくしましまい,Okinodokushima shimai
おきらく忍伝ハンゾー,おきらくにんでんはんぞー,Okiraku ninden Hanzo
おきらく忍伝ハンゾーR,おきらくにんでんはんぞーるーぷ,Okiraku ninden Hanzo Ru-pu
おきらくママ,Okiraku Mama,
おくさまが生徒会長!,おくさまがせいとかいちょう,Okusama ga seito kaichou
奥さま進化論,おくさましんかろん,Okusma sinnkaronn
奥さまはアイドル♥,おくさまはあいどる,Okusama wa idol
奥さまは魔法少女,おくさまはまほうしょうじょ,Madam is a Magical Girl (Okusama ha Mahou-syoujo)
屋上に咲く花 水あさと短編集,おくじょうにさくはな みずあさとたんぺんしゅう,Okujou ni Saku Hana
屋上姫,おくじょうひめ,Okujou hime
オクターヴ,Octave,
奥の細道,おくのほそみち,Oku no hosomichi
奥浩哉短編集「赤」,おくひろやたんぺんしゅうあか,Oku Hiroya Tanpenshuu Aka
奥浩哉短編集「黒」,おくひろやたんぺんしゅうくろ,Oku Hiroya Tanpenshuu Kuro
おくりびと,OKURIBITO,
オーケーFANTASISTA!,おーけーふぁんたじすた,OK FANTASISTA!
オケラのつばさ,Okera no Tsubasa,
おこしやす,Okoshiyasu,
オコジョさん,Okojosan,
お酒は夫婦になってから,おさけはふうふになってから,Osake ha fuufu ni nattekara
幼なじみリレイション,おさななじみりれいしょん,Osana najimi Relation
おざなりダンジョン,OZANARI DUNGEON,
オサムシ教授の事件簿,おさむしきょうじゅのじけんぼ,Professor OSA''MUSHI''S REPORT
おさるなまさるくん,Osarunamasarukun,
おさわがせプリズムレディ,OSAWAGASEPRIZUMLADY,
オシエシラバス,Syllabus of OSHIE,
教えてFGO!偉人と神話のぐらんどおーだー,おしえてえふじーおー いじんとしんわのぐらんどおーだー,Oshiete FGO! Ijin to shinwa no Grand Order
おしえて!ギャル子ちゃん,おしえてぎゃるこちゃん,Oshiete! Gyaruko-chan
おしえて菜花,おしえてなのか,Teach me NANOKA
おしおきっ!,Oshioki,
おしかけツインテール,Oshikake twintail,
押しかけ時姫,おしかけときひめ,Oshikake Tokihime
推しが武道館いってくれたら死ぬ,おしがぶどうかんいってくれたらしぬ,Oshi ga Budoukan Ittekuretara Shinu
お仕事です!,おしごとです,Women's company (Oshigoto desu!)
おじさまと猫,おじさまとねこ,Ojisama to neko
お慕い申し上げます,おしたいもうしあげます,Oshitai Moushiagemasu
おしのびっつ!,Oshinobits! (Oshinobittsu),
おしゃべりな時間割,おしゃべりなじかんわり,Osyaberi na Jikanwari
おじゃまユーレイくん,OJYAMAYUREIKUN,
おしゃれ手帖,おしゃれてちょう,Stylish Notebook ( Oshare Techou )
オーシャンまなぶ,Ocean Manabu,
お受験キッズいぶき☆ハイテンション,おじゅけんきっずいぶきほしはいてんしょん,Ojuken Kids Ibuki High Tension
お嬢様と私 たなぼた中国恋愛絵巻,おじょうさまとわたし たなぼたちゅうごくれんあいえまき,Ojousama to watashi tanabota chuugoku renai emaki
お嬢様はアイスがお好き。,おじょうさまはあいすがおすき,Ojousama wa ice ga osuki
お嬢様はお嫁様。,おじょうさまはおよめさま,She is bride
お嬢だん,おじょうだん,Ojyodan
おじょじょじょ,Ojojojo,
OZ -オズ-,おず,OZ
OZ ‐オズ‐ (岩井恭平&刻夜セイゴ版),おず いわいきょうへい あんど こくよせいごばん,OZ: by Iwai Kyohei
押忍!空手部,おすからてぶ,OSU KARATE CLUB
押忍!ガンバ,おすがんば,Osu! Gamba
押忍!!麻雀部,おすまーじゃんぶ,OSUMAJANBU
オズマ隊長,おずまたいちょう,CAPT.OZMA
おすもじっ!,Osumoji!,
オセロゲーム,EBONY &amp; IVORY,
おせん,Osen,
遅咲きじじい,おそざきじじい,Osozaki jijii
おそって・オオカミくん,OSOTTE OHKAMI kun,
おそ松くん,おそまつくん,Osomatukun
おそ松さん,おそまつさん,Osomatsusan
おそるべしっっ!!!音無可憐さん,おそるべしっっおとなしかれんさん,Osorubeshi!!!Otonashi Karen San
おタエさんは今日もたべたい,おたえさんはきょうもたべたい,Otaesan wa kyou mo tabetai
おたかぜ君,おたかぜくん,Otakaze-kun
おたくの娘さん,おたくのむすめさん,Otaku no musumesan
オタクの用心棒,おたくのようじんぼう,Bodyguard of the geek
オタサーの姫殺人事件,おたさーのひめさつじんじけん,Otacir no Hime Satsujin Jiken
織田シナモン信長,おだしなもんのぶなが,ODA SHINAMON NOBUNAGA
織田信長 (横山光輝版),おだのぶなが,Oda Nobunaga
織田信奈の野望,おだのぶなのやぼう,Oda Nobuna no Yabou
Order-Made (オーダーメイド),おーだーめいど,Order-made
おたやん。,Otayan,
小田原ドラゴンくえすと,おだわらどらごんくえすと,Odawara Doragon Quest
おたんこナース,Otanko Nurse,
おちこぼれフルーツタルト,Ochikobore fruit tart,
オチつく家族,おちつくかぞく,OCHITUKUKAZOKU
オチビサン,Ochibi-san,
お茶にごす。,おちゃにごす,OTYANIGOSU
お茶の間,おちゃのま,OCHANOMA
お茶の間クエスト,おちゃのまくえすと,Ochanoma Quest
お憑かれさん(おじゃまんが島田くん お憑かれさん),おつかれさん おじゃまんがしまだくん おつかれさん,Ojamanga Shimadakun Otsukaresan
Odds,おっず,Odds
Odds GP!,おっず じーぴー,Odds GP!
オッス!少林寺,おっす しょうりんじ,Ossu! Shourinji
オッス!はるかちゃん,Ossu Haruka Cyan,
夫のちんぽが入らない,おっとのちんぽがはいらない,Otto no chinpo ga hairanai
おっとり捜査,おっとりそうさ,Ottori Sousa
オデッセイ,Odyssey,
OHでりしゃす!!,おーでりしゃす,Oh delicious!!
お天気お姉さん,おてんきおねえさん,Otenki Oneesan
おてんき君,おてんきくん,Otenki kun
お天気の巫女,おてんきのみこ,Otenki no Miko
おてんば珠姫さま!,おてんばたまひめさま,Otemba Tamahime sama
お父さんといっしょ!!,おとうさんといっしょ,Otosanto Issyo!!
お父さんは心配症,おとうさんはしんぱいしょう,Otosan wa shinpaisho
お父さんは時代小説が大好き,おとうさんはちゃんばらがだいすき,Otousann ha tyannbara ga daisuki
お父さんは年下,おとうさんはとしした,Otousan wa toshishita
弟の夫,おとうとのおっと,Otouto no Otto
オトウフようちえん,Otoufu youchien,
おとぎストーリー天使のしっぽ,おとぎすとーりーてんしのしっぽ,Otogi Story - Tenshi no Shippo P.E.T.S
おとぎの国のメメントモリ,おとぎのくにのめめんともり,Otogi no Kuni no Memento mori
おとぎのまちのれな,Otogi No Machi No Rena,
お伽話がきこえる,おとぎばなしがきこえる,Otogibanashi ga kikoeru
お伽話をあなたに,おとぎばなしをあなたに,The fairy tale story for you
おとぎ奉り,おとぎまつり,Otogi Matsuri
お伽もよう綾にしき,おとぎもようあやにしき,Otogimoyou ayanisiki
男一匹ガキ大将,おとこいっぴきがきだいしょう,Otoko ippiki gaki daishou
男おいどん,おとこおいどん,OTOKOOIDON
男大空,おとこおおぞら,OTOKOOHZORA
おとこ女おんな男,おとこおんなおんなおとこ,Otoko Onna Onna Otoko
男樹,おとこぎ,Otokogi
男樹四代目,おとこぎよんだいめ,Otokogi 4th(Otokogi Yondaime)
男組,おとこぐみ,OTOKO-GUMI
男坂,おとこざか,Otoko Zaka
男塾外伝 紅!!女塾,おとこじゅくがいでん くれない おんなじゅく,Otoko Juku Gaiden: Kurenai Onna Juku
男塾外伝 大豪院邪鬼,おとこじゅくがいでん だいごういんじゃき,Otoku Juku Gaiden: Daigouin Jaki
男塾外伝 伊達臣人,おとこじゅくがいでん だておみと,Otoko juku gaiden Date Omito
男ぞ!硬介,おとこぞこうすけ,Otoko zo! Kousuke
男たちの好日〜もう一つの経済創世記・牧玲睦物語〜,おとこたちのこうじつ もうひとつのけいざいそうせいき まきれいぼくものがたり,The Story of Reiboku Maki(Otoko tati no koujitsu)
男たちの大和/YAMATO,おとこたちのやまと,MEN OF YAMATO
男魂ロック,おとこだまろっく,Otokodama Rock
男どアホウ甲子園,おとこどあほうこうしえん,Otoko Doahou Koushien
男!度胸 メダカードファイターズ‎,おとこどきょうめだかーどふぁいたーず,Otoko Dokyo medacard fighters
男トラゴロウ,おとことらごろう,Otokotoragoro
男なら勝利の歌を,おとこならしょうりのうたを,OTOKONARA SHOURINO UTAWO
オート/コーネル,おーとこーねる,AUTOCORNELL
男の一枚 レッド・カード,おとこのいちまい れっどかーど,Otoko no ichimai Red Card
娚の一生,おとこのいっしょう,Otoko no issyo
おとこのこ物語,おとこのこものがたり,Otokonoko Monogatari
オトコの娘ラヴァーズ!!,おとこのこらばぁーず,Otokonoko lovers
男の自画像,おとこのじがぞう,Man's self-portrait
男の星座,おとこのせいざ,Otoko no Seiza
おとこ道,おとこみち,OTOKOMICHI
侠飯,おとこめし,Otokomeshi
男麺,おとこめーん,Otokomen
音無し幻十,おとなしげんじゅう,OTONASHI GENJU
音無さんは破壊神!,おとなしさんははかいしん,Otonashi-san wa hakaishin!
オトナになる方法,おとなになるほうほう,Otona ni naru houhou
オトナのいろは,Otona no iroha,
おとなの時間,おとなのじかん,Adult times
おとなのしくみ,Otona No Shikumi,
おとなの生徒手帳,おとなのせいとてちょう,Otona no Seitotechou
お隣さんゲーム,おとなりさんげーむ,Otonarisan game
おとなりボイスチャット,OTONARI Voice chat,
おとの教室,おとのきょうしつ,Oto no kyoushitsu
乙姫各駅散歩,おとひめかくえきさんぽ,Otohime kakueki sanpo
オート・フォーカス,Auto Focus,
おとぼけ課長,おとぼけかちょう,Otoboke kachou
おとぼけ茄子先生,おとぼけなすびせんせい,Otoboke Nasubisensei
AT Lady!,おーとまちっくれでぃ,Automatic Lady!
乙女色Stay Tune,おとめいろすていちゅーん,Otomeiro Stay Tune
乙女ウイルス,おとめういるす,Otome Virus
オトメシュラン,Otome-chelin (Otomeshuran),
乙女戦争 ディーヴチー・ヴァールカ,おとめせんそう でぃーぶちーばーるか,Divci valka
乙女とちぎり,おとめとちぎり,Otome to chigiri
乙女の力コブ,おとめのちからこぶ,Otome no Chikarakobu
オトメの帝国,おとめのていこく,Otome no Teikoku
乙女のホゾシタ,おとめのほぞした,Otome no Hozoshita
乙女ほるもん,おとめほるもん,Otome horumon
おとめ妖怪 ざくろ,おとめようかい ざくろ,Otome Youkai Zakuro
おとめ恋々,おとめれんれん,Otome renren
オトメン(乙男),Otomen,
おともだち,Otomodachi,
お友達からはじめましょう。,おともだちからはじめましょう,Otomodachi kara hajimemasyou
乙嫁語り,おとよめがたり,Otoyome Gatari
おトラさん,Otora san,
躍らないなら死ねばいいのに,おどらないならしねばいいのに,Odoranai nara shineba iinoni
おどりませんっ!,I don't dance!( Odorimasen! ),
おとりよせ王子 飯田好実,おとりよせおうじ いいだよしみ,Otoriyose Ouji Ida Yoshimi
踊る!アントワネットさま,おどるあんとわねっとさま,Odoru! Antoinette-sama
踊る教室,おどるきょうしつ,Odoru Kyoushitsu
踊る警官,おどるけいかん,Odoru Keikan
おどろきももの木笑店街,おどろきもものきしょうてんがい,Odoroki Momonoki Syoutengai
おどろ 〜陽子と田ノ中の百鬼行事件簿〜,おどろ ようことたのなかのひゃっきこうじけんぼ,Odoro Youko to Tanonaka no hyakkukou jikenbo
おどろ領域ナユラ,おどろりょういきなゆら,Odoro Ryouiki Nayura
同じ月を見ている,おなじつきをみている,Onaji Tsuki wo Miteiru
おなり〜っ ボロッ殿だい,おなりーっぼろっとのだい,Onari Borottono dai
鬼 (山岸涼子版),おに,Oni
おにいさまへ…,おにいさまへ,From brother
おにいちゃん★コントロール,おにいちゃんこんとろーる,Oniichan control
お兄ちゃんと一緒,おにいちゃんといっしょ,Brother together
お兄ちゃんのことなんかぜんぜん好きじゃないんだからねっ!!,おにいちゃんのことなんかぜんぜんすきじゃないんだからね,Onichan no koto nanka zenzen suki ja naindakarane!!
お兄ちゃんビフォーアフター,おにいちゃんびふぉーあふたー,Oniichan before after
鬼踊れ!!,おにおどれ,Oni odore
鬼が来たりて,おにがきたりて,Oni ga kitarite
鬼が出るか蛇が出るか,おにがでるかじゃがでるか,Oni ga deruka ja ga deruka
鬼切様の箱入娘,おにきりさまのはこいりむすめ,Onikirisama no hakoirimusume
鬼切丸,おにきりまる,Onikirimaru
鬼切丸伝,おにきりまる でん,Onikirimaru Den
鬼組,おにぐみ,Team Oni(Oni-Gumi)
鬼組 THE REVOLVER,おにぐみ ざ りぼるばー,ONIGUMI THE REVOLVER
鬼ごっこ,おにごっこ,Oni-Gokko
鬼さんコチラ(重本ハジメ),おにさんこちら,Onisan kochira
おにさん、こちら(昼間行燈),Onisan Kochira (Hiruma Andon),
鬼死ね,おにしね,Oni shine
鬼ジャリ,おにじゃり,Onijari
オニデレ,ONI DERE,
オニナギ,Oninagi,
鬼のヒデトラ,おにのひでとら,Oni no Hidetora
鬼姫,おにひめ,Oni Hime
オニヒメ,Onihime 2016,
鬼平犯科帳,おにへいはんかちょう,ONIHEI HANKACHOU
オニマダラ,Onimadara,
鬼丸大将,おにまるたいしょう,Onimaru taisho
おにまん,Oniman,
鬼虫,おにむし,Onimushi
おにもて,Onimote,
鬼若と牛若 Edge of the World,おにわかとうしわか えっじおぶざわーるど,Oniwaka to Ushiwaka Edge of the World
鬼ヲ辿リテ幾星霜,おにをたどりていくせいそう,Oni wo tadorite ikuseisou
お義姉さんと僕。,おねえさんとぼく,Oneesan to boku
お姉さんは女子小学生に興味があります。,おねえさんはじょししょうがくせいにきょうみがあります,Oneesama wa joshishougakusei ni kyoumi ga arimasu
お姉ちゃんが来た,おねえちゃんがきた,Oneechan ga kita
おねがい朝倉さん,おねがいあさくらさん,Onegai Asakura san
お願い神サマ!,おねがいかみさま,"Please My God, Please... (Onegai Kamisama!)"
おねがい☆ティーチャー,おねがいてぃーちゃー,Please Teacher
お願い!ロイヤルニート,おねがいろいやるにーと,Onegai! royal neet
おねだりしてみて,Onedari shitemite,
おのぼり物語,おのぼりものがたり,Onobori Monogatari
老女的少女ひなたちゃん,おばあちゃんしょうじょひなたちゃん,The Cute Little Granny Girl Hinata chan
オバケのQ太郎,おばけのきゅうたろう,Obake no Kyuutarou
オバコブラ,OBACOBRA,
オバー自慢の爆弾鍋,おばーじまんのばくだんなべ,Obah Jiman no Bakudan Nabe
OPUS,おーぱす,OPUS
OVER TIME,おーばーたいむ,OVER TIME
オバタリアン,Obatarian,
OverDrive(オーバードライブ),おーばーどらいぶ,OverDrive
オーバードライブ魂,おーばーどらいぶこん,OVER DRIVE SPIRITS
お話になりません,おはなしになりません,Ohanashi ni narimasen
オハナホロホロ,Ohana Holoholo,
オバハンSOUL,おばはんそうる,Obahan SOUL
オーバーマンキングゲイナー,OVERMAN KING-GAINER,
O-HA-YO,おはよー,O-HA-YO
おはようおかえり,Ohayou Okaeri,
おはようKジロー,おはようけーじろー,Good morning Keijiro
おはようサバイブ,Good morning Survive,
おはよう!スパンク,Good Morning!Spank.,
オーバーレブ!,Over Reb!,
オーバーロード,Overlord,
OH・パンタクBOY,おーぱんたくぼーい,OH PANTAKU BOY
おひさま笑顔(向日葵),おひさまえがお ひまわり,OHISAMA EGAO
おひっこし,Ohikkoshi,
お一人様二つまで!,おひとりさまふたつまで,With up to two per person!
おひとり様物語,おひとりさまものがたり,Story of herself (Ohitori-sama monogatari)
おひとり食堂,おひとりしょくどう,Ohitori shokudou
帯をギュッとね!,おびをぎゅっとね,Obi O Gyuttone
オフィスのざしきわらし,Office no Zashiki Warashi,
オフィス北極星,おふぃすほっきょくせい,Office North Star
オフサイド,Offside,
オブリガード!,OBRIGADO!,
オープンセサミ,OPEN SESAME,
オープンセサミ〜武藤啓版〜,おーぷんせさみ むとうけいばん,Open sesami
オーベルジュろわぞぶりゅ,Auberge L'oiseau bleu,
OPERATION G.G.,おぺれーしょんじーじー,OPERATION G.G.
お坊サンバ!,おぼうさんば,Obou-Samba!
おぼっちゃまくん,Obotutyama kun,
溺れるナイフ,おぼれるないふ,Oboreru knife
溺れる花火,おぼれるはなび,Oboreru hanabi
朧,おぼろ,OBORO
OH!MYコンブ,おーまいこんぶ,OH!MY KONBU
お前はまだグンマを知らない,おまえはまだぐんまをしらない,You do not yet know Gumma
お前ら全員めんどくさい!,おまえらぜんいんめんどくさい,Omaera zenninn mendokusai
おまかせピース電器店,おまかせぴーすでんきてん,Omakase! Peace denkiten
おまけの小林クン,おまけのこばやしくん,Omake no Kobayashi kun
