title,title_furigana,title_en
出逢った頃の君でいて,であったころのきみでいて,Deatta koro no kimi de ite
出会って5秒でバトル,であってごびょうでばとる,Deatte 5 Byou de Battle
出会って12時間で婚約した話。,であってじゅうにじかんでこんやくしたはなし,A story engaged in 12 hours after meeting
dear,でぃあ,Dear
Dear Emily... 〜da capo〜,でぃあえみりー だかーぽ,Dear Emily da capo
DearS (ディアーズ),でぃあーず,DearS
ティアーズ・トゥ・ティアラ 花冠の大地,てぃあーずとうてぃあらかかんのだいち,Tears to Tiara: Earth's Wreath
ディアスポリス 異邦警察,でぃあすぽりす いほうけいさつ,Dias Police
ディアティア,Dear Tear,
DEAR BOYS (DEAR BOYS Act II / DEAR BOYS Act III),でぃあぼーいず,DEAR BOYS (DEAR BOYS Act II
DIABOLUS(ディアボロス),でぃあぼろす,DIABOLUS
ディアボロのスープ,Diabolo no soup,
ディア マイン,Dear Mine,
Dear Monkey 西遊記,でぃあーもんきーさいゆうき,Dear Monkey Saiyuuki
ディアルガVSパルキアVSダークライ 劇場版ポケットモンスタースペシャルコミック,でぃあるがたいぱるきあたいだーくらい げきじょうばんぽけっともんすたーすぺしゃるこみっく,Pokemon: The Rise of Darkrai Theater version Pokemon special comic
帝一の國,ていいちのくに,Teiichi no kuni
D・N・A2〜何処かで失くしたあいつのアイツ〜,でぃーえぬえー つー どこかでなくしたあいつのあいつ,DNA2 - Dokoka de Nakushita Aitsu no Aitsu -
D・N・ANGEL(ディー・エヌ・エンジェル),でぃーえぬえんじぇる,DNAngel
D・M激王伝ゲット,でぃーえむげぎおうでんげっと,Duel Masters gekiouden Getto
ディエンビエンフー,Dien Bien Phu,
TEI OH-!(ていおー!),ていおー,TEI OH-!
帝王,ていおう,TEIOU
帝王への道,ていおうへのみち,Teiou Heno Miti
でぃおてぃまにゅある 〜神様たちの恋愛代行〜,でぃおてぃまにゅある かみさまたちのれんあいだいこう,Dioti Manual Kamisamatachi no Renai Daikou
てーきゅう,Teekyu,
テイク・ザBスタジオ,ていくざびーすたじお,TAKE THE B STUDIO
D.Gray-man (ディー・グレイマン),でぃーぐれいまん,D.Gray-man
TKman,てぃーけーまん,TKman
帝国の神兵,ていこくのしんぺい,Teikoku no Shinpei
ディザインズ,Designs,
TG天使ジャイ子ちゃんDX,てぃじぃてんしじゃいこちゃんでらっくす,TG Angel Gyaiko-chan DX
ティジクン!,Teijikun!,
デイジー〜3.11 女子高生たちの選択〜,でいじーさんてんいちいちじょしこうせいたちのせんたく,DAISY
DCD,でぃーしーでぃー,DCD diamond cat diamond
亭主元気で犬がいい,ていしゅげんきでいぬがいい,Teisyu genki de Inu ga ii
DAYS(デイズ),でいず,DAYS
ディスオーダー,Disorder,
ディスコミュニケーション,Discommunication,
TISTA,てぃすた,TISTA
でぃすぱっち!!,DHISUPUTI,
ディス魔トピア,でぃすまとぴあ,Desumasutopia
This Man その顔を見た者には死を,でぃすまん そのかおをみたもにはしを,This Man sono Kao wo Mita Mono Niha shi wo
17ANS(ディセタン),でぃせたん,17ANS
D線上のアリス,でぃーせんじょうのありす,Alice on DeadLine
D-ZOIC,でぃーぞいっく,D-ZOIC
低俗霊狩り,ていぞくれいがり,Vulgar soul hunting
低俗霊DAYDREAM,ていぞくれいでいどりーむ,DAYDREAM the lowbrow ghost(Teizokurei DayDream)
DタウンCロック,でぃーたうんしーろっく,D town C rock
D.D.D.,でぃーでぃーでぃー,D D D
DD北斗の拳,でぃーでぃーほくとのけん,DD Hokuto no Ken
帝都 女記者伝 写・らく,ていとおんなきしゃでん しゃらく,SHA RAKU
帝都物語,ていとものがたり,Babylon tokyo
帝都雪月花,ていとゆきづきはな,Teito setsugetsuka
デイドリームネイション,DAY DREAM NATION,
DAY DREAM BELIEVER,でいどりーむびりーばー,DAY DREAM BELIEVER
ディノ・サピエンス,Dino Sapiens,
DV,でぃー ぶい,DV
DEFENSE DEVIL(ディフェンス・デビル),でぃふぇんすでびる,DEFENSE DEVIL
D4プリンセス,でぃーふぉーぷりんせす,D4 princess
ディーふらぐ!,D-FRAGMENTS,
Deep Love〜アユの物語〜,でぃーぷらぶあゆのものがたり,Deep Love-ayu's story-
Deep Loveホスト,でぃーぷらぶほすと,Deep Love-host-
Deep Love REAL,でぃーぷらぶ りある,Deep Love REAL
Dimension W (ディメンションW),でぃめんしょん だぶりゅー,Dimension W
悪魔の花嫁,でいもすのはなよめ,The Bride of the Demon(Deimos no Hanayome)
ディーラー8,でぃーらーえいと,Dealer 8
帝立第13軍学校歩兵科異常アリ!?,ていりつだいじゅうさんぐんがっこうほへいかいじょうあり,Teiritsu Dai 13 gun Gakkou Hoheika Ijou Ari !?
ティリニア物語,てぃりにあものがたり,Tale of Tirinia
テイルズ オブ イノセンス,Tales of Innocence,
テイルズ オブ エターニア,Tales of Eternia,
テイルズ オブ シンフォニア,Tales of symphonia,
テイルズ オブ デスティニー2,ているず おぶ ですてぃにー2,Tales of Destiny2
テイルズ オブ デスティニー 〜神の眼をめぐる野望〜,ているずおぶですてぃにーかみのめをめぐるやぼう,Tales of Destiny: kami no me wo meguru yabou
テイルズ オブ ヴェスペリア,Tales of Vesperia,
テイルズ オブ ヴェスペリア 虚空の仮面,ているずおぶべすぺりあ こくうのかめん,Tales of Vesperia Kokuu no kamen
テイルズ オブ ヴェスペリア 〜明星たちの軌跡〜,ているずおぶべすぺりあ みょうじょうたちのきせき,Tales of Vesperia Myoujou tachi no kiseki
テイルズ オブ レジェンディア,TALES OF LEGENDIA,
TAIL STAR (テイルスター),ているすたー,TAIL STAR
ティルナフロウ,Til na flow,
てぃんくる☆コレクション〜ハッピーKAWAiiiiiii革命♡〜,てぃんくるこれくしょんはっぴーかわいいかくめい,Tincle CollectionHappy KAWAiiiiiii revolution
刑事が一匹…,でかがいっぴき,Deka Ga Ippiki
デカガール,Deka Girl,
デカ教師,でかきょうし,Deka kyoushi
でかけモン,Dekakemon,
デカスロン,Dekasuron,
デカダン!―デザイン科男子の受難―,でかだん でざいんかだんしのじゅなん,Dekadan! Daily Lives of design dept. high school boys
テガミバチ,TEGAMIBACHI,
デカメーン,Dekamern,
的中!青春100%,てきちゅうせいしゅん100ぱーせんと,Tekichuu! seishun 100%
適齢期の歩き方,てきれいきのあるきかた,Tekireiki no aruki kata
できんボーイ,Dekin Boy,
木偶 BLOCK HEAD,でく ぶろっくへっど,Deku BLOCK HEAD
てけてけマイハート,Teketeke My heart,
凸凹アニメーション,でこぼこあにめーしょん,Dekoboko animation
デザイナー,Designer,
デザインノイロハ,How to design?,
デザート,Dessert,
デザートイーグル,Desert Eagle,
砂の薔薇(デザートローズ),でざーとろーず,Desert Rose
デザートローズ(鷹見隼人版),Desert Rose (Hayato Takami version),
デジコン,Dezi con,
DIGITALIAN,でじたりあん,DIGITALIAN
手品先輩,てじなせんぱい,Tejina-senpai
デジモンアドベンチャー Vテイマー01,でじもんあどべんちゃー ぶいていまー ぜろわん,Digimon adventure V Tamer 01
デジモンクロスウォーズ,DIGIMON XROS WARS,
デジモンネクスト,Digimon Next,
デジモンユニバース アプリモンスターズ,DIGIMON UNIVERSE APPLI MONSTERS,
デジモンユニバース アプリモンスターズ アプモン学園,でじもんゆにばーす あぷりもんすたーず あぷもんがくえん,DIGIMON UNIVERSE APPLI MONSTERS APUMON GAKUEN
デジャヴ,Dejavu,
DEATH SWEEPER(デス・スウィーパー),ですすうぃーぱー,DEATH SWEEPER
テスタロト,Testarotho,
デスちち,Death chichi,
死.TV,ですどっとてぃーびー,Death.TV
DEATHTOPIA(デストピア),ですとぴあ,DEATHTOPIA
デストロ246,ですとろ246,Destro 246
デストロイ アンド レボリューション,Destroy and Revolution,
DEATH NOTE (デスノート),ですのーと,Deathnote
DEATH NOTE (デスノート) -HOW TO READ-,ですのーとはうとうりいど,Death Note How to read
デスパイ,Desupai,
デスハンター,Death hunter,
デスペナ,Desupena,
DESPERADO(デスペラード),ですぺらーど,DESPERADO
テセウスの船,てせうすのふね,Ship Of Theseus
デゾルドル,DESORDRE,
でたとこプリンセス,DETATOKO PRINCESS,
出たな!ツインビー,でたなついんびー,DETANATWINBEE
鉄壱智,てついち,Tetsuichi
でっかいんちょ,Dekkaincho,
手塚治虫 マリン・エクスプレス,てづかおさむまりんえくすぷれす,Tezuka Osamu Marine Express
哲学さんと詭弁くん,てつがくさんときべんくん,Tetsugakusan to kibenkun
鉄楽レトラ,てつがくれとら,Tetsugaku retora
鉄火の巻平,てっかのまきへい,Tekka No Makihei
鉄仮面のイブキさん,てつかめんのいぶきさん,Tetsukamen no Ibuki-san
鐵血のアマリリス,てっけつのあまりりす,The Amaryllis of Bloody Ferrum
鉄拳児耕助,てっけんじこうすけ,Iron fist boy Kousuke
鉄拳チンミ,てっけんちんみ,Tetu ken Tinmi
鉄拳チンミLegends,てっけんちんみれじぇんず,Tekken Chinmi Legends
鉄工所のヒカリ,てっこうじょのひかり,Tekkoujo no Hikari
鉄甲神剣ゴウジン,てっこうしんけんごうじん,GOUJIN
鉄鋼闘機ガイラ,てっこうとうきがいら,Tekko Toki Gaira
鉄娘な3姉妹,てつこなさんしまい,Tetsuko na san shimai
鉄子の旅,てつこのたび,Tetsuko no tabi
鉄コン筋クリート,てっこんきんくりーと,Black And White (Tekkon Kinkreet)
鉄魂!! ZOIDS核闘技,てっこんぞいどかくとうぎ,Tekkon ZOIDS Kakutougi
鉄人28号 〜鉄人奪還作戦〜 (さとうふみや版),てつじん28ごう てつじんだっかんさくせん さとうふみやばん,Tetsujin 28-gou Tetsujin Recapture Operation
鉄人ガンマ,てつじんがんま,Ganma The Iron Man
鉄人28号,てつじんにじゅうはちごう,Tetsujin 28-gou
鉄人28号 〜皇帝の紋章〜 (長谷川裕一版),てつじんにじゅうはちごうこうていのもんしょうはせがわゆういちばん,Tetsujin 28-gou Emperor's crest
鉄戦士ムサシ,てつせんしむさし,Ironwarior Musashi
鉄鼠の檻,てっそのおり,Tesso no ori
デッド・オア・ストライク,Dead or Strike,
Dead or LIVE!,でっどおあらいぶ,Dead or live!
デッドコピー,Dead copy,
デッド・ソウル・リボルバー,Deadsoulrevolbar,
DEAD Tube,でっどちゅーぶ,DEAD Tube
デッドデッドデーモンズデデデデデストラクション,Dead dead daemons de de de de destruction,
DEADMAN,でっどまん,DEADMAN
デッドマン・ワンダーランド,DEADMAN WONDERLAND,
手つなぎ鬼,てつなぎおに,Tetsunagi Oni
鉄鍋のジャン!,てつなべのじゃん,Iron Wok Jan!
鉄鍋のジャン!R 頂上決戦,てつなべのじゃん りたーん ちょうじょうけっせん,IRON WOK JAN! R THE SUMMIT OPERATIONS
鉄の王,てつのおう,Tetsu no ou
鉄のサムソン,てつのさむそん,Tetsu no Samson
鉄の旋律,てつのせんりつ,Tetsunosenritsu Melody of Iron
鉄のドンキホーテ,てつのどんきほーて,Iron Don Quixote
鉄のほそ道,てつのほそみち,Tetsu No Hosomichi
鉄の道,てつのみち,Iron Road
鉄牌のジャン!,てつはいのじゃん,Tetsuhai no Jan
てっぱん!,Teppann,
鉄板少女アカネ!!,てっぱんしょうじょあかね,Teppan shoujo Akane!!
鉄風,てっぷう,TEPPUU
てっぺん,TEPPEN,
鉄民,てつみん,TETSUMIN
鉄面クロス,てつめんくろす,Tetsumen Cross
鉄面探偵ゲン,てつめんたんていげん,Tetsumentantei Gen
哲也-雀聖と呼ばれた男,てつや じゃんせいとよばれたおとこ,Tetsuya-The man who was called Jansei
鉄腕アダム,てつわんあだむ,Tetsuwan Adam
鉄腕アトム,てつわんあとむ,Astro Boy (Tetsuwan Atomu)
鉄腕ガール,てつわんがある,Girl Professional Baseball Foundation
鉄腕バーディー,てつわんばーでぃー,Birdy The Mighty
鉄腕バーディーEVOLUTION,てつわんばーでぃーえぼりゅーしょん,Birdy The Mighty Evolution
鉄腕バーディー(オリジナル版),てつわんばーでぃーおりじなるばん,Birdy The Mighty(original)
鉄腕ブレイク,てつわんぶれいく,Tetsuwan Break
デート・ア・ストライク,DATE A STRIKE,
デート・ア・パーティー,DATE A PARTY,
デート・ア・ライブ(犬威赤彦版),DATE A LIVE Inui Sekihiko,
デート・ア・ライブ(ringo版),DATE A LIVE ringo,
てとくち,Tetokuchi,
手と手を合わせて,てとてをあわせて,Te to te o awasete
デトロイト・メタル・シティ,DETROIT METAL CITY,
出直しといで!,でなおしといで,Denaoshitoide
テニスの王子様,てにすのおうじさま,The Prince of Tennis
テニスボーイ,Tennis boy,
てのひらにアイを!,Tenohira Ni Ai O,
てのひらの熱を,てのひらのねつを,Tenohira No Netsu O
手のりおかん,てのりおかん,Tenori Okan
デビデビ,Devidevi,
デビューマン,Debut Men,
デビリーマン,Devilyman,
デビル17,でびる17,Devil 17
デビルエクスタシー,Devil ecstasy,
デビルキング,Devil King,
デビルサバイバー,Devil survivor,
デビルサマナー 葛葉ライドウ対コドクノマレビト,でびるさまなー くずはらいどうたいこどくのまれびと,Devil summoner Kuzuha raidou vs Kodokunomarebito
DEVIL SMILE(デビルスマイル),でびるすまいる,Devil Smile Aki Niina
デビル・フットボール・キングダム,Devil football kingdom,
デビルマン,Devilman,
デビルマンG,でびるまんぐりもわーる,DEVILMAN GRIMOIRE
デビルマンサーガ,Devilman saga,
デビルマン対ゲッターロボ,でびるまんたいげったーろぼ,Devilman VS GetterRobot
デビルマン対闇の帝王,でびるまんたいやみのていおう,DEVILMAN vs HADES
デビルマン(蛭田充版),Devilman (Hiruta Mitsuru),
デビルマンレディー,Devilman Lady,
デビル メイ クライ,Devil May Cry,
てぶくろてっちゃん,Tebukuro Tecchan,
でぶせん,Debusen,
デブになってしまった男の話,でぶになってしまったおとこのはなし,Debu ni Natte Shimatta Otoko no Hanashi
でぶぼの,Debubono,
Developers 機動戦士ガンダム Before One Year War,でべろっぱーずきどうせんしがんだむびふぉーわんいやーうぉー,Developers Kidousenshi Gundam Before One Year War
亜人ちゃんは語りたい,でみちゃんはかたりたい,DEMIcyan ha kataritai
デモクラティア,Democratia,
デーモン聖典(サクリード),でーもんさくりーど,Demon Sacred
デモンズプラン,Demons Plan,
DEMON TUNE -デーモンチューン-,でーもんちゅーん,Demon Tune
DUEL!,でゅえる,DUEL
デュエル・ジャック!!,Duel Jack,
デュエルヒーローDASH,でゅえるひーろーだっしゅ,Duel hero DASH
デュエルファイター刃,でゅえるふぁいたーじん,Duel fighter Jin
デュエルマスターズ(デュエルマスターズFE/デュエルマスターズSX),Duel Masters,
デュエル・ マスターズSAGA,でゅえるますたーずさーが,Duel Mastars SAGA
デュエル・マスターズ 覇王伝ガチ!!,でゅえる ますたーず はおうでん がち,Duel Masters: Haouden Gachi
デュエルマスターズビクトリー(デュエル・マスターズVS),Duel Masters Victory,
D・Mファイター焔,でゅえるますたーずふぁいたー ほのお,DM FIGHTERS HONOO
DUEL MASTERS REV.(デュエル・マスターズ・レボリューション),でゅえる ますたーず れぼりゅーしょん,DUEL MASTERS REV.
デュラララ!!,Dhurarara!!,
デュラララ!! 黄巾賊編,でゅららら こうきんぞくへん,Durarara!! Koukinzoku hen
デュラララ!! 罪歌編,でゅららら さいかへん,Durarara!! Saika hen
デュラララ!! 3way standoff -alley-,でゅららら すりーうぇいすたんどおふ あれい,Durarara!! 3way standoff -alley-
デュラララ!! RE;ダラーズ編,でゅららら りだらーずへん,Durarara!! Re;Dollars hen
デュラララ!! Relay,でゅらららりれー,Durarara!! Relay
デラシネマ,Dera Cinema,
寺島さんは悟っている,てらしまさんはさとっている,Terashima-san ha satotteiru
テラーナイト,Terror Night,
テラフォポリス ばっかも〜ん! 出る杭課24時,てらふぉぽりすばっかもん でるくいかにじゅうよじ,TERRAFO POLICE Bakkamon! Derukuika 24ji
テラフォーマーズ,Terra formars,
テラフォーマーズ外伝 鬼塚慶次,てらふぉーまーずがいでん おにづかけいじ,TERRA FORMARS gaiden Onizuka Keiji
テラフォーマーズ外伝 アシモフ,てらふぉーまーずがいでんがいでん あしもふ,Terra Formars Gaiden Asimov
テラフォーマーズ外伝 RAIN HARD,てらふぉーまーずがいでん れいんはーど,TERRA FORMARS Gaiden Rain Hard
テラフォーマーズ妄想訓練記 教えて!ミッシェル教官,てらふぉーまーずもうそうくんれんき おしえてみっしぇるきょうかん,Terra Formars Mousou Kunrenki Oshiete Michelle Kyoukan
地球へ…,てらへ,TOWARD THE TERRA
てらほくん,Terahokun,
テラモリ,Teramori,
でり研,でりけん,Deli ken
デリシャス!,Delicious!,
DELETE〈デリート〉,でりーと,DELETE
デリバリー,Delivery,
デリバリーシンデレラ,Delivery Cinderella,
照子ちゃんは恥ずかしがり屋,てるこちゃんははずかしがりや,Teruko-chan wa hazukashigariya
てるてる天神通り,てるてるてんじんどおり,Teru Teru Tenjin street
出るトコ出ましょ!,でるとこでましょ,Deru toko demasho!
デルトラクエスト,DELTORA QUEST,
テルマエ・ロマエ,THERMAE ROMAE,
テルミ×テルミ×テルミ,てるみてるみてるみ,TEL ME TELUMI TELL ME
てるみな,Termina (Terumina),
テレパシー少女 蘭,てれぱしーしょうじょらん,Telepathy girl RAN
てれびさん,TVsan,
TVジャッカー,てれびじゃっかー,TV Jacker
テレビ天使,てれびてんし,Television tenshi
舞姫(テレプシコーラ),てれぷしこーら,Maihime(Terepsikola)
でろでろ,Derodero,
デロリンマン,Derorinman,
天衣無縫 武蔵坊弁慶,てんいむほう むさしぼうべんけい,Teni Muhou Musashibou Benkei
電影少女(ビデオガール),でんえいしょうじょ びでおがーる,Video girl
天外君の華麗なる悩み,てんがいくんのかれいなるなやみ,Tengaikun no kareinaru nayami
天界の勇者ナン魔クエスト,てんかいのゆうしゃなんまくえすと,Nanma Quest (Quest of Nanma: The Cerestial brave)
天外レトロジカル,てんがいれとろじかる,Tengai Retrogical
TENKA FUBU 信長,てんかふぶのぶなが,TENKAFUBU NOBUNAGA
天下無双 江田島平八伝,てんかむそう えだじまへいはちでん,TENKA MUSOU
デンキ街の本屋さん,でんきがいのほんやさん,Denkigai no honyasan
てんぎゃん 〜南方熊楠伝〜,てんぎゃん みなかたくまぐすでん,TENGYAN: Minakata Kumaugusu den
天空侵犯,てんくうしんぱん,Tenkuu Shinpan
天空聖龍〜イノセント・ドラゴン〜,てんくうせいりゅう いのせんとどらごん,Tenkuu seiryuu Inocent dragon
天空戦記シュラト,てんくうせんきしゅらと,Tenkuu Senki Shurato
天空忍伝バトルボイジャー,てんくうにんでんばとるぼいじゃー,Tenku Ninden Battle Voyager
天空のエスカフローネ,てんくうのえすかふろーね,Vision of Escaflowne
天空の覇者Z,てんくうのはしゃつぇっと,Tenku no Hasha Z
天空の蜂,てんくうのはち,Tenkuu no Hachi
天空の門,てんくうのもん,The gate of the heavens
天空の要塞,てんくうのようさい,Fugaku The Skyfortres
天狗陰陽道,てんぐおんみょうどう,Tenguonmyodo
テングガール,Tengu girl,
天啓のアリマリア,てんけいのありまりあ,Tenkei no arimaria
電撃テンジカーズ,でんげきてんじかーず,Dengeki Tenjikers
電撃ドクターモアイくん,でんげきどくたーもあいくん,Dengeki Doctor Moai kun
電撃!ピカチュウ,でんげきぴかちゅう,Dengeki Pikatyuu
天眷御伽草子,てんけんおとぎぞうし,Tenken otogi zoushi
天顕祭,てんけんさい,Tenkensai
天元突破グレンラガン,てんげんとっぱぐれんらがん,Tengen toppa Gurren-lagann
天元突破グレンラガン 紅蓮学園篇,てんげんとっぱぐれんらがん ぐれんがくえんへん,Tengen Toppa Gurren Lagann Gurren Gakuen hen
天元突破グレンラガン 螺旋少年譚,てんげんとっぱぐれんらがん らせんしょうねんたん,Tengen toppa Gurren-lagann Rasen shounen hen
電光オズマ,でんこうおずま,DENKOOZUMA
天獄 -HEAVEN'S PRISON-,てんごく,Tengoku -HEAVEN'S PRISON-
天国大魔境,てんごくだいまきょう,Tengoku Daimakyo
天国でポン!,てんごくでぽん,Tengoku de pon!
天国にいちばん近いフィールド,てんごくにいちばんちかいふぃーるど,Tengoku ni ichiban chikai field
天国に結ぶ戀,てんごくにむすぶこい,Tengoku ni musubu koi
天国ニョーボ,てんごくにょーぼ,Tengoku Nyobo
天獄の島,てんごくのしま,Tengoku No Shima
天国のススメ!,てんごくのすすめ,Eocouragement of heaven!
天獄パラダイス,てんごくぱらだいす,Ten goku paradise
天国への階段,てんごくへのかいだん,Tengoku He No Kaidan
天子様が来る!,てんこさまがくる,Tenko sama ga kuru
天才伝説,てんさいでんせつ,Tensai Densetsu
天才伝説 第2章,てんさいでんせつだいにしょう,Tensai Densetsu 2
天才ドンベ,てんさいどんべ,GENIOUS DONBE
天才バカボン,てんさいばかぼん,Tensaibakabon
天才ファミリー・カンパニー,てんさいふぁみりーかんぱにー,Genius family company
天才 柳沢教授の生活,てんさいやなぎさわきょうじゅのせいかつ,Tensai Yanagisawa kyouju no seikatsu
天才料理少年 味の助,てんさいりょうりしょうねんあじのすけ,Tensai Ryouri-shonen Ajinosuke
天使禁猟区,てんしきんりょうく,Tensi kinryou ku
天竺熱風録,てんじくねっぷうろく,Tenjiku nepuuroku(comic)
天使じゃないもん,てんしじゃないもん,Tenshi jya naimon
電子戦隊デンジマン,でんしせんたいでんじまん,Denshisentaidenjiman
天使とアクト!!,てんしとあくと,Tenshi to act!!
天使とダイヤモンド,てんしとだいやもんど,Tenshi to diamond
天智と天武-新説・日本書紀-,てんじとてんむしんせつにほんしょき,Tenji to Tenmu
天使な小悪魔,てんしなこあくま,Tenshi na koakuma
天使な小生意気,てんしなこなまいき,Cheeky Angel (Tenshi na Konamaiki)
天使なんかじゃない,てんしなんかじゃない,Tenshi Nankaja Nai
天使1/2方程式,てんしにぶんのいちほうていしき,Tenshi nibun no iti houteisiki
天使のお仕事,てんしのおしごと,Tenshi no Oshigoto
天使のココロで,てんしのこころで,Tenshi No kokorode
天使の裁量,てんしのさいりょう,Discretion of the Angel
天使の時空船-レオナルド・ダ・ヴィンチの伝説,てんしのじくうせんれおなるどだびんちのでんせつ,Tenshi No Jikusen
天使の事情,てんしのじじょう,Tenshi no jijou
天使の棲む部屋,てんしのすむへや,Angil room
天使の3P!,てんしのすりーぴーす,Tenshi no 3P!
天使の玉ちゃん,てんしのたまちゃん,Tenshi no Tama chan
天使のフライパン,てんしのふらいぱん,Tenshi no frypan
てんしの末裔,てんしのまつえい,Tenshi no matsuei
電車男 がんばれ毒男,でんしゃおとこ がんばれどくお,Densha-otoko Ganbare dokuo
電車男〜でも、俺旅立つよ。〜,でんしゃおとこ でもおれたびだつよ,Densha-Otoko Demo Ore Tabidatsuyo.
電車男(原秀則),でんしゃおとこ はらひでのり,"Densha-otoko Ver,Hidenori Hara"
テンジュの国,てんじゅのくに,Tenju No Kuni
転生學園月光録,てんしょうがくえんげっこうろく,Tensho gakuen gekoroku
電子妖精アバタモ☆エクボ,でんしようせいあばたもえくぼ,Erectron fairy Abatamo Ekubo (Denshi Yousei Abatamo Ekubo)
天上天下,てんじょうてんげ,TENJHO TENGE
天上天下唯我独尊,てんじょうてんげゆいがどくそん,Tenjoutenge Yuigadokuson
天上の愛 地上の恋,てんじょうのあいちじょうのこい,Tenjou no ai chijou no koi
天翔のクアドラブル,てんしょうのくあどらぶる,The Soaring QUADRABLE
天上の弦,てんじょうのげん,The Life of a Man Who Headed Toward Stradivari
天上の虹-持統天皇物語-,てんじょうのにじ じとうてんのうものがたり,Tenzyou no nizi Zitou tennou monogatari
天翔の龍馬,てんしょうのりょうま,Tensho no Ryoma
天正やおよろず,てんしょうやおよろず,Tensyo Yaoyorozu
天食,てんしょく,Tenshoku
天職貴族 モン次郎,てんしょくきぞくもんじろう,Tenshoku-kizoku Monjirou
天審 〜WORLD WAR ANGEL〜,てんしん,Tenshin
電人ザボーガー(一峰大二版),でんじんざぼーがー かずみねだいじばん,Denjin Zaborgar
電人ファウスト,でんじんふぁうすと,Denjin Faust
てんしんらん漫!,てんしんらんまん,Tenshinranman!
天神乱漫 -LUCKY or UNLUCKY!?-,てんしんらんまん らっきーおああんらっきー,Tenshinranman LUCKY or UNLUCKY!?
