title,title_furigana,title_en
とある科学の一方通行<アクセラレータ>,とあるかがくのあくせられーた,Toaru kagaku no Accelerator
とある科学の超電磁砲,とあるかがくのれーるがん,To Aru Kagaku no Railgun
とある新人漫画家に、本当に起こったコワイ話,とあるしんじんまんがかにほんとうにおこったこわいはなし,The scary story that really happened to a certain new face comic artist
とある飛空士への追憶,とあるひくうしへのついおく,Toaru Hikushi e no Tsuioku
ト或ル夫婦ノ日乗,とあるふうふのにちじょう,Toaru fuufu no nichijou
とある魔術の禁書目録,とあるまじゅつのいんでっくす,To aru majutsu no index
電脳戦機バーチャロン×とある魔術の禁書目録 とある魔術の電脳戦機,とあるまじゅつのいんでっくす でんのうせんきばーちゃろん とあるまじゅつのばーちゃろん,Toaru majutsu no Virtual-on
とある魔術のヘヴィーな座敷童が簡単な殺人妃の婚活事情,とあるまじゅつのへびーなざしきわらしがかんたんなさつじんきのこんかつじじょう,Toaru Majutsu no heavy na zashikiwarashi ga kantan na satsujinki no konkatsu jijou
TO-Y,とーい,TO-Y
DOIS SOL,どいそる,DOIS SOL
トイレット博士,といれっとはかせ,TOIRETHAKASE
トゥー・エスプレッソ,Two espresso,
桃華月憚,とうかげったん,Touka gettan
同・級・生,どうきゅうせい,DOKYUSEI
同級生のマッチョ君,どうきゅうせいのまっちょくん,Mr.Macho My classmate
東京!,とうきょう,Toukyou!
東京アンダーグラウンド,とうきょうあんだーぐらうんど,Tokyo-Underground
TOKYO ANTS 叶恭弘短編集Ⅱ,とうきょうあんつ かのうやすひろたんぺんしゅう,TOKYO ANTS
東京ESP,とうきょういーえすぴー,Tokyo ESP
東京イノセント,とうきょういのせんと,Tokyo innocent
東京エイティーズ―80's love & pop! campus romance graffiti,とうきょうえいてぃーず えいてぃーずらぶあんどぽっぷきゃんぱすろまんすぐらふぃてぃー,Tokyo 80's 80's love &amp; pop! campus romance graf
東京怪童,とうきょうかいどう,Tokyo Kaidou
東京家族,とうきょうかぞく,Tokyo family
東京カラス,とうきょうからす,Tokyo Calas
東京クレイジーパラダイス,とうきょうくれいじーぱらだいす,TOKYO CRAZE PARADISE
東京ゲンジ物語,とうきょうげんじものがたり,Tokyo Genji monogatari
東京昆虫ムスメ,とうきょうこんちゅうむすめ,Tokyo koncyu musume
東京自転車少女。,とうきょうじてんしゃしょうじょ,Tokyo Jitensha Shoujyo
東京シャッターガール,とうきょうしゃったーがーる,Tokyo shutter girl
倒凶十将伝,とうきょうじゅうしょうでん,To u kyo u zyu syo u de n
東京ジュリエット,とうきょうじゅりえっと,Tokyo Jurietuto
東京大学物語,とうきょうだいがくものがたり,Tokyo-daigaku monogatari
東京タラレバ娘,とうきょうたらればむすめ,Tokyo tarareba musume
東京探偵団,とうきょうたんていだん,Tokyo Tanteidan
東京DTED,とうきょうでぃーてぃーいーでぃー,Tokyo DTED
東京刑事,とうきょうでか,Cop in Tokyo (Tokyo deka)
東京トイボックス,とうきょうといぼっくす,Tokyo Toy Box
東京都北区赤羽,とうきょうときたくあかばね,Tokyoto Kitaku Akabane
東京都北区赤羽以外の話(人間バンザイ!!),とうきょうときたくあかばねいがいのはなし,"Story except Akabane, Kita-ku, Tokyo"
東京都新宿区歌舞伎町 プチッコホーム,とうきょうとしんじゅくかぶきちょうぷちっこほーむ,Puchikko-Home
TOKYO TRIBE2,とうきょうとらいぶ2,TOKYO TRIBE 2
凍京NECRO トウキョウ・ネクロ,とうきょうねくろ,Tokyo NECRO
東京発 異世界行き,とうきょうはついせかいいき,Tokyo Hatsu Isekai Iki
東京BABYLON (バビロン),とうきょうばびろん,TOKYO BABYLON
TOKYO BARDO,とうきょうばるど,TOKYO BARDO
東京犯罪物語-菩薩と不動-,とうきょうはんざいものがたり ぼさつとふどう,Tokyo Crimical Story Bosatsu &amp; Fudou
東京番長,とうきょうばんちょう,Tokyo Banchou
東京プー,とうきょうぷー,Tokyo pu
東京ファンタジー学園勇者科 月彩のノエル,とうきょうふぁんたじーがくえんゆうしゃか つきいろののえる,Tokyo Fantasy Gakuen Yushaka Tsukiiro no Noel
東京深川三代目,とうきょうふかがわさんだいめ,"Tokyo Fukagawa 3rd,"
東京ヘロヘロ紀行,とうきょうへろへろきこう,Tokyo Herohero Kikou
東京魔人學園剣風帖,とうきょうまじんがくえんけんぷうちょう,Tokyo Majin Gakuen Kenpucho
東京ミカエル,とうきょうみかえる,Tokyo mikaeru
東京ミュウミュウ,とうきょうみゅうみゅう,TOKYO MEW MEW
東京メイト,とうきょうめいと,Tokyo Mate
東京命日,とうきょうめいにち,Tokyo meinichi
東京眼鏡,とうきょうめがね,Tokyo Megane
東京物語,とうきょうものがたり,Toukyou monogatari
東京闇虫,とうきょうやみむし,Toukyou yamimushi
東京闇虫 -2nd scenario- パンドラ,とうきょうやみむし せかんどしなりお ぱんどら,Tokyo Yamimushi second scenario Pandora
東京ラブストーリー,とうきょうらぶすとーりー,TOKYO LOVE STORY
東京ラブストーリー 〜After25years〜,とうきょうらぶすとーりー あふたー25いやーず,Tokyo Love Story After25years
東京卍リベンジャーズ,とうきょうりべんじゃーず,Tokyo revengers
東京レイヴンズ,とうきょうれいぶんず,Tokyo Ravens
東京レイヴンズ ANOTHER×holiday,とうきょうれいぶんずあなざーほりでー,TOKYO RAVENS ANOTHER holiday
東京レイヴンズ ‐Girls Photograph‐,とうきょうれいぶんず がーるずふぉとぐらふ,TOKYO RAVENS -Girls Photograph-
東京レイヴンズ Sword of Song,とうきょうれいぶんず そーどおぶそんぐ,TOKYO RAVENS Sword of Song
東京レイヴンズ 東京フォックス,とうきょうれいぶんず とうきょうふぉっくす,TOKYO RAVENS TOKYO FOX
東京レイヴンズ RED AND WHITE,とうきょうれいぶんず れっどあんどほわいと,TOKYO RAVENS RED AND WHITE
東京浪漫細工,とうきょうろまんざいく,Tokyo roman zaiku
TOKYO WONDER BOYS(トーキョーワンダーボーイズ),とうきょうわんだーぼーいず,TOKYO WONDER BOYS
どうぎんぐ,Douging,
桃源郷 甲斐谷忍短編集,とうげんきょう かいたにしのぶたんぺんしゅう,Tougenkyou
瞳子,とうこ,Touko
闘魂パンダーランド,とうこんぱんだーらんど,Fighting spirit Panderland
桃魂ユーマ,とうこんゆーま,Toukon Yuma
東西奇ッ怪紳士録,とうざいきっかいしんしろく,Touzai kikkai shinshiroku
どうして私が美術科に!?,どうしてわたしがびじゅつかに,Doushite watashi ga bijutsuka ni!?
東島丹三郎は仮面ライダーになりたい,とうじまたんざぶろうはかめんらいだーになりたい,Tojima Tanzaburo wants to be a Masked rider
東周英雄伝,とうしゅうえいゆうでん,Toushuu Eiyuuden
闘獣士 ベスティアリウス,とうじゅうし べすてぃありうす,Bestialious
トウ・シューズ,Toe Shoes,
トウショウライオン,Tousho Lion,
道士郎でござる,どうしろうでござる,DOUSHIROU DE GOZARU
同人少女 JB,どうじんしょうじょ じぇいびー,Doujin Shoujo JB
闘神デビルマン,とうしん でびるまん,TOSHIN DEVILMAN
闘神伝,とうしんでん,TOH SHIN DEN
同棲レシピ,どうせいれしぴ,Dousei Recipe
東大一直線,とうだいいっちょくせん,Todai icchokusen
東大快進撃,とうだいかいしんげき,Toudai kaishingeki
Do Da Dancin'!,どぅ だ だんしん,Do Da Dancin'!
tutti!,とぅってぃ,Tutti
道徳戦士 超獣ギーガー,どうとくせんしちょうじゅうぎーがー,Doutoku-senshi Choju Gigar
どうなのっ河本さん!,どうなのっこうもとさん,Dounano Koumoto san
どうにかなる日々,どうにかなるひび,Dounika naru hibi
塔のむこう,とうのむこう,Tounomukou
凍牌,とうはい,Touhai
凍牌 ~人柱編~,とうはいひとばしらへん,Touhai Hitobashira hen
2HEARTS(トゥーハーツ),とぅーはーつ,2HEARTS
ToHeart2 (御形屋はるか版),とぅはーと2 おがたやはるか,To Heart 2 (Haruka Ogataya)
To Heart 2 〜colorful note〜,とぅはーと2 からふるのーと,To Heart 2 -colorful note-
どうぶつずかん,Doubutsu Zukan,
動物のお医者さん,どうぶつのおいしゃさん,Doubutu no oishasan
動物のおしゃべり,どうぶつのおしゃべり,Doubutsu no oshaberi
どうぶつの国,どうぶつのくに,Doubutsu no Kuni
どうぶつの森 ホヒンダ村だより,どうぶつのもり ほひんだむらだより,Doubutsu no Mori Hohinda mura dayori
逃亡医F,とうぼういえふ,Touboui F
東方茨歌仙〜 Wild and Horned Hermit.,とうほういばらかせん,Touho Ibara Kasen Wild and Horned Hermit.
東方三月精 Strange and Bright Nature Deity.,とうほうさんげっせいすとれんじあんどぶらいとねいちゃーでゅーてぃー,Three fairies of light in the east. -Strange and Bright Nature Deity.
東方鈴奈庵 〜Forbidden Scrollery.,とうほうすずなあん ふぉーびどぅん すくろーらりー,Touhou Suzunaan Forbidden Scrollery
逃亡弁護士成田誠,とうぼうべんごしなりたまこと,Toubou Bengoshi Narita Makoto
東方儚月抄 -Silent Sinner in Blue.-,とうほうぼうげつしょうさいれんとしなーいんぶるー,Touhoh Bohgetsu-shou. -Silent Sinner in Blue.-
童夢,どうむ,Domu
透明アクセル,とうめいあくせる,Toumei Accel
透明なゆりかご 〜産婦人科医院看護師見習い日記〜,とうめいなゆりかご さんふじんかいいんかんごしみならいにっき,Toumei na yurikago sanhujinka iin kangoshi minarai nikki
透明人間の作り方,とうめいにんげんのつくりかた,How to make Invisible Men
透明人間の骨,とうめいにんげんのほね,Toumei Ningen no Hone
堂本ルール,どうもとるーる,Doumoto Rule
Tomorrows,とぅもろうず,Tomorrows
東遊記,とうゆうき,Touyuuki
東洋妖人伝 用神坊,とうようようじんでん ようじんぼう,Toyo youjinden Youjinbou
どうらく息子,どうらくむすこ,Douraku musuko
動乱,どうらん,DOH RAN
true tears,とぅるーてぃあーず,True tears
True Love,とぅるーらぶ,True Love
遠い星から来たALICE,とおいほしからきたありす,Toi Hoshi kara kita ALICE
遠くへいきたい,とおくへいきたい,Touku Ni Ikitai
遠野モノがたり,とおのものがたり,Tono Mono Gatari
ドオベルマン,Dauberman,
トカゲの王,とかげのおう,Tokage no ou
ドカコック,DOKACOOK!,
どがしかでん,Dogashikaden,
ドカベン(無印),Dokaben,
ドカベン -スーパースターズ編-,どかべん すーぱーすたーずへん,Dokaben Super-Stars hen
ドカベン -ドリームトーナメント編-,どかべん どりーむーなめんとへん,DOKABEN: Dream Tounament
ドカベン -プロ野球編-,どかべん ぷろやきゅうへん,Dokaben: Professional Baseball (Dokaben Proyakyu hen)
トガリ,Togari,
咎狩 白,とがり しろ,Togari shiro
トキ,Nipponia Nippon,
朱鷺色三角,とぎいろとらいあんぐる,Toki iro triangle
トキオ,Tokio,
トキオトナナミ,Tokio to Nanami,
TOKIOの我王,ときおのがおう,TOKIO NO GAOU
時坂さんは僕と地球に厳しすぎる。,ときさかさんはぼくとちきゅうにきびしすぎる,Tokisakasan ha boku to chikyuu ni kibishisugiru
怜-Toki-,とき さきすぴんおふ,Toki (Saki)
どきどき,Doki Doki,
DOKI DOKI(ドキドキ) - 高瀬由香版 -,どきどき たかせゆかばん,DOKI DOKI (Yuka Takase presents)
どきどきDo!れみ,どきどきどれみ,Dokidoki Do! Remi
どきどきハートビート,Dokidokihartbeat,
ドキドキ!プリキュア,Dokidoki Precure,
どきどき魔女神判!,どきどきまじょしんぱん,Dokidoki Majo Shinpan!
時の行者,ときのぎょうしゃ,Toki no Gyoujya
時の守護者,ときのしゅごしゃ,Time Guardian
刻の大地,ときのだいち,Toki no Daichi
ドギばぐ,Do Gi Ba Gu,
ときめきトゥナイト,Tokimeki twunaito,
ときめきトゥナイト 真壁俊の事情,ときめきとぅないと まかべしゅんのじじょう,Tokimeki twunaito makabe shun no jijou
ときめきまっくん!,Tokimeki Makkun!,
ときめきミッドナイト,Tokimeki midnight,
ときめきメモリアル OnlyLove,ときめきめもりある おんりーらぶ,Tokkimeki Memorial Only Love
ときめきももいろハイスクール,Tokimeki Momoiro Highschool,
ド級編隊エグゼロス,どきゅうへんたいえぐぜろす,Dokyuu Hentai Eguzerosu
度胸星,どきょうぼし,Dokyobosi
東京喰種 トーキョーグール,とーきょーぐーる,Tokyo Ghoul
東京喰種 トーキョーグール:re,とーきょーぐーる り,Tokyo Ghoul:re
トキワ来たれり!!,ときわきたれり,Tokiwa kitareri!!
トキワボウルの女神さま,ときわぼうるのめがみさま,The Goddess In Tokiwa Bowl
時をかける少女 after,ときをかけるしょうじょあふたー,Toki wo Kakeru Shoujo After
時をかける少女(琴音らんまる版),ときをかけるしょうじょことねらんまるばん,The Girl Who Leapt Through Time (Toki o Kakeru Shoujo) Kotone Ranmaru's version -
時をかける少女(ツガノ ガク版),ときをかけるしょうじょつがのがくばん,The Girl Who Leapt Through Time (Toki o Kakeru Shoujo) - Tsugano Gaku's version -
毒入り,どくいり,Dokuiri
土偶ファミリー,どぐうふぁみりー,DOGUH FAMILY
徳川家康,とくがわいえやす よこやまみつてる,Tokugawa Ieyasu [Yokoyama Mitsuteru]
徳川生徒会,とくがわせいとかい,Tokugawa Seitokai
徳川八代将軍異聞 吉宗が嗤う,とくがわはちだいしょうぐんいぶん よしむねがわらう,YOSHIMUNE ga Warau
独裁君,どくさいくん,Dokusai kun
トクサツガガガ,Tokusatsu Gagaga,
特殊空挺部隊 雷神,とくしゅくうていぶたいらいじん,Tokushu Kuutei Butai Raijin
独身アパートどくだみ荘,どくしんあぱーとどくだみそう,Dokushin Apart Dokudami Sou
毒頭,どくず,Dokuzu
特捜戦隊デカレンジャー THE MOVIE フルブラスト・アクション,とくそうせんたいでかれんじゃー ざ むーびー ふるぶらすとあくしょん,Tokuso Sentai Dekarenja The Movie Full Blast Action
Dr.アシュラ,どくたーあしゅら,Dr.Ashura
Dr.クマひげ,どくたーくまひげ,Dr.Kumahige
Doctor K(ドクターケー),どくたーけー,Doctor K
ドクターコップ無頼,どくたーこっぷぶらい,Dr.cop Burai
Dr.コトー診療所,どくたーことーしんりょうじょ,Dr. Koto Shinryoujo
ドクター早乙女,どくたーさおとめ,Dr.Saotome
Dr.STONE(ドクターストーン),どくたーすとーん,Dr.STONE
Dr.スランプ,どくたーすらんぷ,Dr. Slump
ドクター秩父山,どくたーちちぶやま,Doctor. CHICHIBUYAMA
Dr.DMAT〜瓦礫の下のヒポクラテス〜,どくたーでぃーまっと がれきのしたのひぽくらてす,Dr.DMAT gareki no shita no hipokuratesu
Dr.デュオ,どくたーでゅお,Dr.DUO
Dr.猫柳田の科学的青春―空想科学大戦!SPECIAL EDITION,どくたーねこやなぎだのかがくてきせいしゅん くうそうかがくたいせん すぺしゃるえでぃしょん,Dr.Nekoyanagida's scientific youth
特ダネ三面キャプターズ,とくだねさんめんきゃぷたーず,Tokudane sanmen captors
Dr.NOGUCHI -ドクター野口-,どくたーのぐち,Dr.NOGUCHI
Dr.ハーレー,どくたーはーれー,Dr.HARLEY
恐怖症博士(ドクター・フォービア),どくたー ふぉーびあ,Dokuta-fo-bia
Dr.プリズナー,どくたーぷりずなー,Dr. Prisoner
ドクターマリオくん,Docter Mario-kun,
ドクターメシア,Dr. Messiah,
Dr.リンにきいてみて!,どくたーりんにきいてみて,Let's take a consult with Dr. Rin/Please Ask Dr. Rin!(Dr. Rin ni Kittemitte)
Dr.るっる,どくたーるっる,Dr. Rurru
毒贄クッキング,どくにえくっきんぐ,Dokunie Cooking
トクボウ 朝倉草平,とくぼう あさくらそうへい,Tokubo-Souhei Asakura
ドクムシ,Dokumushi,
特命係長只野仁,とくめいかかりちょうただのひとし,Tokumei kakarityo tadano hitoshi
特命高校生,とくめいこうこうせい,Tokumeikoukousei
匿名の彼女たち,とくめいのかのじょたち,Tokumei No Kanojo Tachi
特例措置団体ステラ女学院高等科C3部,とくれいそちだんたいすてらじょがくいんこうとうかしーきゅーぶ,Tokurei sochi dantai Stella jogakuin koutouka c cube
DOKURO-毒狼-,どくろ,DOKURO
ドクロ坊主,どくろぼうず,Dokuro bouzu
時計じかけの姉,とけいじかけのあね,Tokei Jikake No Ane
時計仕掛けのりんご,とけいじかけのりんご,Tokei jikake no ringo
どげせん,Dogesen,
棘にくちづけ,とげにくちづけ,Toge ni kuchiduke
どこか遠くの話をしよう,どこかとおくのはなしをしよう,Dokoka tooku no hanashi o shiyou
とことんトシコ,Tokoton Toshiko,
とーこん家族,とーこんかぞく,Tokon kazoku
ど根性ガエル,どこんじょうがえる,Dokonjou Gaeru
ど根性ガエルの娘,どこんじょうがえるのむすめ,Dokonjou Gaeru no Musume
ド根性小学生ボン・ビー太,どこんじょうしょうがくせいぼんびーた,Dokonjou Shougakusei Bonbita
閉ざされたネルガル,とざされたねるがる,Tozasareta Nergal
刀使ノ巫女,とじのみこ,Toji no Miko(comic)
図書委員長の品格,としょいいんちょうのひんかく,Tosyoiinchou no Hinkaku
図書館戦争〜SPITFIRE!,としょかんせんそう すぴっとふぁいあ,Library wars and SPITFIRE
図書館戦争〜LOVE&WAR,としょかんせんそう らぶあんどうぉう,Library wars and LOVE&amp;WAR
図書館の主,としょかんのあるじ,Toshokan no Aruji
ドジラセンセー,Dodzilla Sensei,
ドージン活動、はじめました!?,どーじんかつどう はじめました,Dojin Katsudou hajimemashita
ドージンワーク,Dojin Work,
どすこい!サイぼん,DOSUKOISAIBON,
どす恋ジゴロ,どすこいじごろ,Dosukoi jigoro
ドストエフスキーの犬 ジョージ秋山短編集,どすとえふすきーのいぬ じょーじあきやまたんぺんしゅう,Dostoevsky's dog George Akiyama short edit
ドスペラード,Dosperado,
Doする!?パラダイス,どーするぱらだいす,Do suru!? Paradise.
どーする!?わんこ,Dousuru !? Wanko,
土星マンション,どせいまんしょん,Dosei mansion
ど先端ナース,どせんたんなーす,Do sentan Nurse
トータスデリバリー,Tortoise Delivery,
ドーターメーカー,Daughter Maker,
トータルファイターカオ,Total Fighter KAO,
どついたれ,Dotsuitare,
とっかぶ,Tokkabu,
トッキュー!!,Tokkyu!!,
どっきり!エンジェル,Dokkiri!Angel,
どっきりドクター,Dokkiri doctor,
どっきりマイクローン,Dokkiri My Clone,
どっきんロリポップ,Dokkin lolipop,
DOG END,どっぐえんど,DOG END
DOGS/BULLETS & CARNAGE,どっぐす ばれっつ あんど かーねいじ,DOGS
ドッグソルジャー,Dog Soldier,
特区八犬士[code:T-8],とっくはちけんしこーどてぃー8,Tokku hakkenshi code T8
DOG LAW,どっぐ ろう,Dog Law
とつげきウルフ,TOTUGEKI WOLF,
突撃チキン!,とつげきちきん,Totsugeki Chicken!
突撃!永田町,とつげきながたちょう,Totsugeki!Nagatachou
突撃!パッパラ隊,とつげき ぱっぱらたい,Totugeki! pappara tai
とつげき!ぷるぷる学園,とつげき ぷるぷるがくえん,Totsugeki! Purupuru gakuen
TOKKO,とっこう,TOKKO Devil's awaken
特攻事務員ミノワ,とっこうじむいんみのわ,Tokkou jimuin Minowa
特攻!!ゾイド少年隊,とっこうぞいどしょうねんたい,Tokko zoid syounentai
特攻天女,とっこうてんにょ,Tokkou Tennyo
特攻の島,とっこうのしま,The tale of TOKKOU
突攻!メイドサンダー,とっこう めいどさんだー,Attack!Maid-thunder
ドッ硬連,どっこうれん,Dokkouren
とっても少年探検隊,とってもしょうねんたんけんたい,Tottemo Shounen Tankentai
とってもひじかた君,とってもひじかたくん,TOTTEMOHIJIKATAKUN
とっても!ぷよぷよ,Tottemo puyopuyo,
とっても!ミニモニ。,Very Minimoni,
とってもラッキーマン,Tottemo Luckyman,
ドットインベーダー,DOTINVADER,
とっとこハム太郎,とっとこはむたろう,Tottoko Hamutaro
.hack//4koma,どっとはっく4こま,.hack//4koma
.hack//XXXX,どっとはっくいくすふぉす,.hack//XXXX
.hack//G.U.+,どっとはっくじーゆーぷらす,.hack//G.U.+
.hack//黄昏の腕輪伝説,どっとはっくたそがれのうでわでんせつ,.hack// Tasogare no Udewa Densetsu
.hack//Link 黄昏の騎士団,どっとはっく りんく たそがれのきしだん,.hack//LINK Twilight Knights
トップウGP,とっぷうじーぴー,Toppuu GP
トップ 放課後社長は12さい,とっぷほうかごしゃちょうはじゅうにさい,Top Houkago shacho ha juunisai
トップをねらえ2!,とっぷをねらえ2,Top o nerae2!
トップをねらえ!,The Top Can Be Aimed!(Top O Nerae!),
トップをねらえ! NeXT GENERATION,とっぷをねらえ ねくすとじぇねれーしょん,Aim for the Top GunBuster NeXT GENERATION
トッポ・ジージョ,Topo Gigio,
ドッポたち,Doppo tachi,
どーでもいいけど,Doudemo iikedo,
トト! the wonderful adventure,とと ざ わんだふる あどべんちゃー,TOTO! the wonderful adventure
ドドドドドッジ!,Dododo Dodge!,
どとーの愛,どとーのあい,DOTOU NO AI
トトの世界,ととのせかい,Toto no Sekai
とどのつまり…,とどのつまり,Todo no tsumari
トト (マガジンSPECIAL版),TOTO (Magazine SPECIAL),
とどろけ!一番,とどろけいちばん,Todoroke Ichiiban
となグラ!,TONA-GURA!,
となりで。,Tonaride,
隣の悪女,となりのあくじょ,Tonari No akujo
となりの育児くん。,となりのいくじくん,Tonari no ikujikun
となりの異邦人(エイリアン) ゆうきまさみ短編集,となりのえいりあん ゆうきまさみたんぺんしゅう,Tonari no Alien Masami Yuuki Tanpenshuu
となりの怪物くん,となりのかいぶつくん,Tonari no Kaibutsukun
となりの格闘王,となりのかくとうおう,Tonari no Kakutouou
となりの柏木さん,となりのかしわぎさん,Tonari no Kashiwagi san
となりのカワンチャさん,Tonari no Kawancha-san,
となりの工学ガール,となりのこうがくがーる,My neighbor engineering girl (Tonari no kougaku girl)
となりのシャム猫探偵,となりのしゃむねこたんてい,My Neighbor Detective Siamese Cat
となりの関くん,となりのせきくん,Tonari no Seki kun
となりのたまげ太くん,となりのたまげたくん,Tonari no Tamageta-kun
となりのツァラトゥストラさん,Tonari no Zarathustra san,
となりのなにげさん,Tonari no Nanige san,
となりのネネコさん,Tonari no Neneko san,
隣の町で死んだひと,となりのまちでしんだひと,Tonari no Mati de Sinnda Hito
となりの魔法少女,となりのまほうしょうじょ,Neighbors magical girl (Tonari no mahou shoujo)
となりのメガネ君。,となりのめがねくん,Tonari no Meganekunn
となりの801ちゃん,となりのやおいちゃん,Tonarino801chan
となりのランドセルW,となりのらんどせるだぶりゅー,Tonari no randoseru W
となりの林檎,となりのりんご,Tonari no Ringo
トニカクカワイイ,FLY ME TO THE MOON,
とにかくずるい蓮水くん,とにかくずるいはすみずくん,Tonikaku zurui Hasumizu-san
トニーたけざきのエヴァンゲリオン,Tony Takezaki no EVANGELION,
トニーたけざきのガンダム漫画,とにーたけざきのがんだむまんが,Tony Takezaki presents GUNDAM manga
どーにゃつ,Donyatsu,
殿といっしょ,とのといっしょ,Tono to issho
賭博師 梟,とばくし ふくろう,Gambler Fukurou
鳥獏先輩なに賭ける?,とばくせんぱいなにかける,Tobaku Senpai Ha Nani Kakeru
賭博堕天録カイジ,とばくだてんろくかいじ,Tobaku daten roku Kaiji
賭博堕天録カイジ 和也編,とばくだてんろくかいじかずやへん,Tobaku daten roku Kaiji Kazuya hen
賭博堕天録カイジ ワン・ポーカー編,とばくだてんろくかいじ わんぽーかーへん,Tobaku daten roku Kaiji One poker hen
賭博の巨人,とばくのきょじん,Tobaku no Kyojin
賭博覇王伝 零,とばくはおうでん ぜろ,Tobaku Haou den ZERO
賭博覇王伝 零 ギャン鬼編,とばくはおうでん ぜろ ぎゃんきへん,Tobaku haou den Zero Gyanki hen
賭博破戒録カイジ,とばくはかいろくかいじ,Tobaku hakai roku Kaiji
賭博黙示録カイジ,とばくもくしろくかいじ,Tobaku Mokusiroku KAIJI
飛びだせスチュワーデス!,とびだせすちゅわーです,Tobidase stewardess!
とびだせ!!ターパン,Tobidasetarpan,
とびだせ どうぶつの森,とびだせどうぶつのもり,Tobidase Doubutsu no mori
とびだせ漂流家族,とびだせひょうりゅうかぞく,Tobidase Hyoryu Kazoku
とびっきり!,Tobikkiri,
ドーピング屋台,どーぴんぐやたい,Dooping Yatai
ドビンソン漂流記,どびんそんひょうりゅうき,Dobinson hyouryuuki
飛ぶ教室,とぶきょうしつ,Tobu kyoushitsu
ドブゲロさま,Dobugero sama,
